{
  "artifact_id": "ART-CLAUDE-PARITY-IMPL-FRAME",
  "artifact_kind": "evidence-record",
  "confidentiality": "internal",
  "consumers": [
    {
      "consumer_id": "brownfield-reconnaissance",
      "kind": "stage",
      "purpose": "Supply the brownfield-reconnaissance checkpoint."
    }
  ],
  "content_integrity": {
    "algorithm": "sha256",
    "value": "05d05da43f83c3f644bf8eadd4ceb0553412a0505bd302230450fced3c6e20fc"
  },
  "created_at": "2026-09-16T23:50:00Z",
  "known_defects": [],
  "location": {
    "kind": "workspace-path",
    "value": ".workbench/work/WB-20260916-CLAUDE-PARITY-IMPLEMENTATION/artifacts/outcome-frame.md"
  },
  "obligation_node_ids": [],
  "owner": {
    "actor_id": "user:vince",
    "kind": "human"
  },
  "produced_by": {
    "actor_id": "agent:workbench",
    "kind": "agent"
  },
  "producing_stage": "outcome-framing",
  "proof_ids": [],
  "record_type": "workbench-artifact",
  "schema_version": "0.5.0",
  "source_lineage": [
    {
      "relationship": "derived-from",
      "source": {
        "record_id": "WB-20260916-CLAUDE-PARITY-IMPLEMENTATION",
        "record_type": "work"
      }
    }
  ],
  "status": "current",
  "title": "Parity controller implementation outcome",
  "updated_at": "2026-09-16T23:50:00Z",
  "work_id": "WB-20260916-CLAUDE-PARITY-IMPLEMENTATION"
}
