{
  "artifact_id": "ART-WEG-MODEL",
  "artifact_kind": "data-model",
  "confidentiality": "internal",
  "consumers": [
    {
      "consumer_id": "implementation",
      "kind": "stage",
      "purpose": "Define finding validation and projection behavior."
    }
  ],
  "content_integrity": {
    "algorithm": "sha256",
    "value": "2745b8ed794a4fb18bafc64effee29886220ab41ef2bb03c7ef5c59446aaadd0"
  },
  "created_at": "2026-09-16T21:35:09.1331077Z",
  "known_defects": [],
  "location": {
    "kind": "workspace-path",
    "value": ".workbench/work/WB-20260916-WORKBENCH-EVIDENCE-GUARDS/artifacts/finding-model.md"
  },
  "obligation_node_ids": [],
  "owner": {
    "actor_id": "user:vince",
    "kind": "human"
  },
  "produced_by": {
    "actor_id": "agent:workbench",
    "kind": "agent"
  },
  "producing_stage": "data-model-design",
  "proof_ids": [],
  "record_type": "workbench-artifact",
  "schema_version": "0.5.0",
  "source_lineage": [
    {
      "relationship": "derived-from",
      "source": {
        "record_id": "ART-WEG-RECON",
        "record_type": "artifact"
      }
    }
  ],
  "status": "current",
  "title": "Typed finding model",
  "updated_at": "2026-09-16T21:35:09.1331077Z",
  "work_id": "WB-20260916-WORKBENCH-EVIDENCE-GUARDS"
}
