{
  "artifact_id": "ART-CLAUDE-PARITY-LIVE-RUNNER-RECON",
  "artifact_kind": "evidence-record",
  "confidentiality": "internal",
  "consumers": [
    {
      "consumer_id": "data-model-design",
      "kind": "stage",
      "purpose": "Supply the architecture and durable-evidence design checkpoint."
    }
  ],
  "content_integrity": {
    "algorithm": "sha256",
    "value": "e112698831d0c1cdfc869b70d5ab24409495c0290093b3f16be6ee2deacb43dc"
  },
  "created_at": "2026-09-17T00:55:00Z",
  "known_defects": [],
  "location": {
    "kind": "workspace-path",
    "value": ".workbench/work/WB-20260916-CLAUDE-PARITY-LIVE-RUNNER/artifacts/reconnaissance.md"
  },
  "obligation_node_ids": [],
  "owner": {
    "actor_id": "user:vince",
    "kind": "human"
  },
  "produced_by": {
    "actor_id": "agent:workbench",
    "kind": "agent"
  },
  "producing_stage": "brownfield-reconnaissance",
  "proof_ids": [],
  "record_type": "workbench-artifact",
  "schema_version": "0.5.0",
  "source_lineage": [
    {
      "relationship": "derived-from",
      "source": {
        "record_id": "ART-CLAUDE-PARITY-LIVE-RUNNER-FRAME",
        "record_type": "artifact"
      }
    }
  ],
  "status": "current",
  "title": "Live-runner brownfield reconnaissance",
  "updated_at": "2026-09-17T00:55:00Z",
  "work_id": "WB-20260916-CLAUDE-PARITY-LIVE-RUNNER"
}
