{
  "artifact_id": "ART-CLAUDE-PARITY-LIVE-RUNNER-AUTH-V2",
  "artifact_kind": "evidence-record",
  "confidentiality": "internal",
  "consumers": [
    {
      "consumer_id": "implementation",
      "kind": "stage",
      "purpose": "Record the current implementation grant boundary."
    }
  ],
  "content_integrity": {
    "algorithm": "sha256",
    "value": "60470120f77ea3fcf262646f1687e89a40412613f901df36715d6de2e0b315eb"
  },
  "created_at": "2026-09-17T00:55:50Z",
  "known_defects": [],
  "location": {
    "kind": "workspace-path",
    "value": ".workbench/work/WB-20260916-CLAUDE-PARITY-LIVE-RUNNER/artifacts/implementation-authorization-v2.md"
  },
  "obligation_node_ids": [],
  "owner": {
    "actor_id": "user:vince",
    "kind": "human"
  },
  "produced_by": {
    "actor_id": "agent:workbench",
    "kind": "agent"
  },
  "producing_stage": "delivery-planning",
  "proof_ids": [],
  "record_type": "workbench-artifact",
  "schema_version": "0.5.0",
  "source_lineage": [
    {
      "relationship": "derived-from",
      "source": {
        "record_id": "ART-CLAUDE-PARITY-LIVE-RUNNER-PLAN",
        "record_type": "artifact"
      }
    }
  ],
  "status": "current",
  "title": "Implementation authorization boundary corrected",
  "updated_at": "2026-09-17T00:55:50Z",
  "work_id": "WB-20260916-CLAUDE-PARITY-LIVE-RUNNER"
}
