{
  "artifact_id": "ART-CLAUDE-HARNESS-EVALS-IMPLEMENT",
  "artifact_kind": "implementation",
  "confidentiality": "internal",
  "consumers": [
    {
      "consumer_id": "local-verification",
      "kind": "stage",
      "purpose": "Verify the complete runner and catalog at the public CLI seam."
    }
  ],
  "content_integrity": {
    "algorithm": "sha256",
    "value": "ea4cd9f532f5fbd13c2417905530601d23d2e85e714775a5136c9e8ab5ec100c"
  },
  "created_at": "2026-09-16T22:45:09.002937Z",
  "known_defects": [],
  "location": {
    "kind": "workspace-path",
    "value": ".workbench/work/WB-20260916-CLAUDE-HARNESS-EVALS/artifacts/implementation.md"
  },
  "obligation_node_ids": [],
  "owner": {
    "actor_id": "user:vince",
    "kind": "human"
  },
  "produced_by": {
    "actor_id": "agent:workbench",
    "kind": "agent"
  },
  "producing_stage": "implementation",
  "proof_ids": [],
  "record_type": "workbench-artifact",
  "schema_version": "0.5.0",
  "source_lineage": [
    {
      "relationship": "derived-from",
      "source": {
        "record_id": "ART-CLAUDE-HARNESS-EVALS-PLAN",
        "record_type": "artifact"
      }
    },
    {
      "note": "Scoped implementation authorization.",
      "relationship": "provided-by",
      "source": {
        "record_id": "AUTH-CLAUDE-HARNESS-EVALS-IMPLEMENT",
        "record_type": "authorization"
      }
    }
  ],
  "status": "current",
  "title": "Claude harness evaluation implementation",
  "updated_at": "2026-09-16T22:45:09.002937Z",
  "work_id": "WB-20260916-CLAUDE-HARNESS-EVALS"
}
