{
  "artifact_id": "ART-CLAUDE-OPT-LOOP-IMPLEMENTATION",
  "artifact_kind": "implementation",
  "confidentiality": "internal",
  "consumers": [
    {
      "consumer_id": "local-verification",
      "kind": "stage",
      "purpose": "Verify controller behavior, tamper resistance, provider arguments, fixture isolation, resume semantics, and CLI integration."
    }
  ],
  "content_integrity": {
    "algorithm": "sha256",
    "value": "e55dd71cc79d53d2d2c19ee3e170091e61b059a5d53fca11befcd8da04dbb208"
  },
  "created_at": "2026-09-17T23:12:41Z",
  "known_defects": [],
  "location": {
    "kind": "workspace-path",
    "value": ".workbench/work/WB-20260917-CLAUDE-OPTIMIZATION-LOOP/artifacts/implementation-and-verification.md"
  },
  "obligation_node_ids": [],
  "owner": {
    "actor_id": "user:vince",
    "kind": "human"
  },
  "produced_by": {
    "actor_id": "agent:workbench",
    "kind": "agent"
  },
  "producing_stage": "implementation",
  "proof_ids": [],
  "record_type": "workbench-artifact",
  "schema_version": "0.5.0",
  "source_lineage": [
    {
      "relationship": "derived-from",
      "source": {
        "record_id": "ART-CLAUDE-OPT-LOOP-PLAN",
        "record_type": "artifact"
      }
    }
  ],
  "status": "current",
  "title": "Implemented Claude harness optimization loop",
  "updated_at": "2026-09-17T23:12:41Z",
  "work_id": "WB-20260917-CLAUDE-OPTIMIZATION-LOOP"
}
